,id,title,year,abstract,venues,url
43,824,par: political actor representation learning with social context and expert knowledge,2022,"modeling the ideological perspectives of political actors is an essential task in computational political science with applications in many downstream tasks. existing approaches are generally limited to textual data and voting records, while they neglect the rich social context and valuable expert knowledge for holistic ideological analysis. in this paper, we propose par, a political actor representation learning framework that jointly leverages social context and expert knowledge. specifically, we retrieve and extract factual statements about legislators to leverage social context information. we then construct a heterogeneous information network to incorporate social context and use relational graph neural networks to learn legislator representations. finally, we train par with three objectives to align representation learning with expert knowledge, model ideological stance consistency, and simulate the echo chamber phenomenon. extensive experiments demonstrate that par is better at augmenting political text understanding and successfully advances the state-of-the-art in political perspective detection and roll call vote prediction. further analysis proves that par learns representations that reflect the political reality and provide new insights into political behavior.",['emnlp-2022'],2022.emnlp-main.824.pdf
44,264,from stance to concern: adaptation of propositional analysis to new tasks and domains,2022,"we present a generalized paradigm for adaptation of propositional analysis (predicate-argument pairs) to new tasks and domains. we leverage an analogy between stances (belief-driven sentiment) and concerns (topical issues with moral dimensions/endorsements) to produce an explanatory representation. a key contribution is the combination of semi-automatic resource building for extraction of domain-dependent concern types (with 2-4 hours of human labor per domain) and an entirely automatic procedure for extraction of domain-independent moral dimensions and endorsement values. prudent (automatic) selection of terms from propositional structures for lexical expansion (via semantic similarity) produces new moral dimension lexicons at three levels of granularity beyond a strong baseline lexicon. we develop a ground truth (gt) based on expert annotators and compare our concern detection output to gt, to yield 231% improvement in recall over baseline, with only a 10% loss in precision. f1 yields 66% improvement over baseline and 97.8% of human performance. our lexically based approach yields large savings over approaches that employ costly human labor and model building. we provide to the community a newly expanded moral dimension/value lexicon, annotation guidelines, and gt.","['acl-2022', 'findings-2022']",2022.findings-acl.264.pdf
45,94,a survey on stance detection for mis- and disinformation identification,2022,"understanding attitudes expressed in texts, also known as stance detection, plays an important role in systems for detecting false information online, be it misinformation (unintentionally false) or disinformation (intentionally false information). stance detection has been framed in different ways, including (a) as a component of fact-checking, rumour detection, and detecting previously fact-checked claims, or (b) as a task in its own right. while there have been prior efforts to contrast stance detection with other related tasks such as argumentation mining and sentiment analysis, there is no existing survey on examining the relationship between stance detection and mis- and disinformation detection. here, we aim to bridge this gap by reviewing and analysing existing work in this area, with mis- and disinformation in focus, and discussing lessons learnt and future challenges.","['findings-2022', 'naacl-2022']",2022.findings-naacl.94.pdf
46,101,politics: pretraining with same-story article comparison for ideology prediction and stance detection,2022,"ideology is at the core of political science research. yet, there still does not exist general-purpose tools to characterize and predict ideology across different genres of text. to this end, we study pretrained language models using novel ideology-driven pretraining objectives that rely on the comparison of articles on the same story written by media of different ideologies. we further collect a large-scale dataset, consisting of more than 3.6m political news articles, for pretraining. our model politics outperforms strong baselines and the previous state-of-the-art models on ideology prediction and stance detection tasks. further analyses show that politics is especially good at understanding long or formally written texts, and is also robust in few-shot learning scenarios.","['findings-2022', 'naacl-2022']",2022.findings-naacl.101.pdf
47,39,differential bias: on the perceptibility of stance imbalance in argumentation,2022,"most research on natural language processing treats bias as an absolute concept: based on a (probably complex) algorithmic analysis, a sentence, an article, or a text is classified as biased or not. given the fact that for humans the question of whether a text is biased can be difficult to answer or is answered contradictory, we ask whether an “absolute bias classification” is a promising goal at all. we see the problem not in the complexity of interpreting language phenomena but in the diversity of sociocultural backgrounds of the readers, which cannot be handled uniformly: to decide whether a text has crossed the proverbial line between non-biased and biased is subjective. by asking “is text x more [less, equally] biased than text y?” we propose to analyze a simpler problem, which, by its construction, is rather independent of standpoints, views, or sociocultural aspects. in such a model, bias becomes a preference relation that induces a partial ordering from least biased to most biased texts without requiring a decision on where to draw the line. a prerequisite for this kind of bias model is the ability of humans to perceive relative bias differences in the first place. in our research, we selected a specific type of bias in argumentation, the stance bias, and designed a crowdsourcing study showing that differences in stance bias are perceptible when (light) support is provided through training or visual aid.","['aacl-2022', 'findings-2022']",2022.findings-aacl.39.pdf
48,83,knowledge stimulated contrastive prompting for low-resource stance detection,2022,"stance detection task (sdt) aims at identifying the stance of the sentence towards a specific target and is usually modeled as a classification problem. backgound knowledge is often necessary for stance detection with respect to a specific target, especially when there is no target explicitly mentioned in text. this paper focuses on the knowledge stimulation for low-resource stance detection tasks. we firstly explore to formalize stance detection as a prompt based contrastive learning task. at the same time, to make prompt learning suit to stance detection, we design a template mechanism to incorporate corresponding target into instance representation. furthermore, we propose a masked language prompt joint contrastive learning approach to stimulate the knowledge inherit from the pre-trained model. the experimental results on three benchmarks show that knowledge stimulation is effective in stance detection accompanied with our proposed mechanism.","['findings-2022', 'emnlp-2022']",2022.findings-emnlp.83.pdf
49,151,assisting the human fact-checkers: detecting all previously fact-checked claims in a document,2022,"given the recent proliferation of false claims online, there has been a lot of manual fact-checking effort. as this is very time-consuming, human fact-checkers can benefit from tools that can support them and make them more efficient. here, we focus on building a system that could provide such support. given an input document, it aims to detect all sentences that contain a claim that can be verified by some previously fact-checked claims (from a given database). the output is a re-ranked list of the document sentences, so that those that can be verified are ranked as high as possible, together with corresponding evidence. unlike previous work, which has looked into claim retrieval, here we take a document-level perspective. we create a new manually annotated dataset for the task, and we propose suitable evaluation measures. we further experiment with a learning-to-rank approach, achieving sizable performance gains over several strong baselines. our analysis demonstrates the importance of modeling text similarity and stance, while also taking into account the veracity of the retrieved previously fact-checked claims. we believe that this research would be of interest to fact-checkers, journalists, media, and regulatory authorities.","['findings-2022', 'emnlp-2022']",2022.findings-emnlp.151.pdf
50,294,you are what you talk about: inducing evaluative topics for personality analysis,2022,"expressing attitude or stance toward entities and concepts is an integral part of human behavior and personality. recently, evaluative language data has become more accessible with social media’s rapid growth, enabling large-scale opinion analysis. however, surprisingly little research examines the relationship between personality and evaluative language. to bridge this gap, we introduce the notion of evaluative topics, obtained by applying topic models to pre-filtered evaluative text from social media. we then link evaluative topics to individual text authors to build their evaluative profiles. we apply evaluative profiling to reddit comments labeled with personality scores and conduct an exploratory study on the relationship between evaluative topics and big five personality facets, aiming for a more interpretable, facet-level analysis. finally, we validate our approach by observing correlations consistent with prior research in personality psychology.","['findings-2022', 'emnlp-2022']",2022.findings-emnlp.294.pdf
51,335,opening up minds with argumentative dialogues,2022,"recent research on argumentative dialogues has focused on persuading people to take some action, changing their stance on the topic of discussion, or winning debates. in this work, we focus on argumentative dialogues that aim to open up (rather than change) people’s minds to help them become more understanding to views that are unfamiliar or in opposition to their own convictions. to this end, we present a dataset of 183 argumentative dialogues about 3 controversial topics: veganism, brexit and covid-19 vaccination. the dialogues were collected using the wizard of oz approach, where wizards leverage a knowledge-base of arguments to converse with participants. open-mindedness is measured before and after engaging in the dialogue using a questionnaire from the psychology literature, and success of the dialogue is measured as the change in the participant’s stance towards those who hold opinions different to theirs. we evaluate two dialogue models: a wikipedia-based and an argument-based model. we show that while both models perform closely in terms of opening up minds, the argument-based model is significantly better on other dialogue properties such as engagement and clarity.","['findings-2022', 'emnlp-2022']",2022.findings-emnlp.335.pdf
52,406,language model detoxification in dialogue with contextualized stance control,2022,"to reduce the toxic degeneration in a pretrained language model (lm), previous work on language model detoxification has focused on reducing the toxicity of the generation itself (self-toxicity) without consideration of the context. as a result, a type of implicit offensive language where the generations support the offensive language in the context is ignored. different from the lm controlling tasks in previous work, where the desired attributes are fixed for generation, the desired stance of the generation depends on the offensiveness of the context. therefore, we propose a novel control method to do context-dependent detoxification with the stance taken into consideration. we introduce meta prefixes to learn the contextualized stance control strategy and to generate the stance control prefix according to the input context. the generated stance prefix is then combined with the toxicity control prefix to guide the response generation. experimental results show that our proposed method can effectively learn the context-dependent stance control strategies while keeping a low self-toxicity of the underlying lm.","['findings-2022', 'emnlp-2022']",2022.findings-emnlp.406.pdf
53,259,extracting and analysing metaphors in migration media discourse: towards a metaphor annotation scheme,2022,"the study of metaphors in media discourse is an increasingly researched topic as media are an important shaper of social reality and metaphors are an indicator of how we think about certain issues through references to other things. we present a neural transfer learning method for detecting metaphorical sentences in slovene and evaluate its performance on a gold standard corpus of metaphors (classification accuracy of 0.725), as well as on a sample of a domain specific corpus of migrations (precision of 0.40 for extracting domain metaphors and 0.74 if evaluated only on a set of migration related sentences). based on empirical results and findings of our analysis, we propose a novel metaphor annotation scheme containing linguistic level, conceptual level, and stance information. the new scheme can be used for future metaphor annotations of other socially relevant topics.",['lrec-2022'],2022.lrec-1.259.pdf
54,261,lpattack: a feasible annotation scheme for capturing logic pattern of attacks in arguments,2022,"in argumentative discourse, persuasion is often achieved by refuting or attacking others’ arguments. attacking an argument is not always straightforward and often consists of complex rhetorical moves in which arguers may agree with a logic of an argument while attacking another logic. furthermore, an arguer may neither deny nor agree with any logics of an argument, instead ignore them and attack the main stance of the argument by providing new logics and presupposing that the new logics have more value or importance than the logics presented in the attacked argument. however, there are no studies in computational argumentation that capture such complex rhetorical moves in attacks or the presuppositions or value judgments in them. to address this gap, we introduce lpattack, a novel annotation scheme that captures the common modes and complex rhetorical moves in attacks along with the implicit presuppositions and value judgments. our annotation study shows moderate inter-annotator agreement, indicating that human annotation for the proposed scheme is feasible. we publicly release our annotated corpus and the annotation guidelines.",['lrec-2022'],2022.lrec-1.261.pdf
55,293,iso-based annotated multilingual parallel corpus for discourse markers,2022,"discourse markers carry information about the discourse structure and organization, and also signal local dependencies or epistemological stance of speaker. they provide instructions on how to interpret the discourse, and their study is paramount to understand the mechanism underlying discourse organization. this paper presents a new language resource, an iso-based annotated multilingual parallel corpus for discourse markers. the corpus comprises nine languages, bulgarian, lithuanian, german, european portuguese, hebrew, romanian, polish, and macedonian, with english as a pivot language. in order to represent the meaning of the discourse markers, we propose an annotation scheme of discourse relations from iso 24617-8 with a plug-in to iso 24617-2 for communicative functions. we describe an experiment in which we applied the annotation scheme to assess its validity. the results reveal that, although some extensions are required to cover all the multilingual data, it provides a proper representation of discourse markers value. additionally, we report some relevant contrastive phenomena concerning discourse markers interpretation and role in discourse. this first step will allow us to develop deep learning methods to identify and extract discourse relations and communicative functions, and to represent that information as linguistic linked open data (llod).",['lrec-2022'],2022.lrec-1.293.pdf
56,344,arcovidvac: analyzing arabic tweets about covid-19 vaccination,2022,"the emergence of the covid-19 pandemic and the first global infodemic have changed our lives in many different ways. we relied on social media to get the latest information about covid-19 pandemic and at the same time to disseminate information. the content in social media consisted not only health related advice, plans, and informative news from policymakers, but also contains conspiracies and rumors. it became important to identify such information as soon as they are posted to make an actionable decision (e.g., debunking rumors, or taking certain measures for traveling). to address this challenge, we develop and publicly release the first largest manually annotated arabic tweet dataset, arcovidvac, for covid-19 vaccination campaign, covering many countries in the arab region. the dataset is enriched with different layers of annotation, including, (i) informativeness more vs. less importance of the tweets); (ii) fine-grained tweet content types (e.g., advice, rumors, restriction, authenticate news/information); and (iii) stance towards vaccination (pro-vaccination, neutral, anti-vaccination). further, we performed in-depth analysis of the data, exploring the popularity of different vaccines, trending hashtags, topics, and presence of offensiveness in the tweets. we studied the data for individual types of tweets and temporal changes in stance towards vaccine. we benchmarked the arcovidvac dataset using transformer architectures for informativeness, content types, and stance detection.",['lrec-2022'],2022.lrec-1.344.pdf
57,405,investigating user radicalization: a novel dataset for identifying fine-grained temporal shifts in opinion,2022,"there is an increasing need for the ability to model fine-grained opinion shifts of social media users, as concerns about the potential polarizing social effects increase. however, the lack of publicly available datasets that are suitable for the task presents a major challenge. in this paper, we introduce an innovative annotated dataset for modeling subtle opinion fluctuations and detecting fine-grained stances. the dataset includes a sufficient amount of stance polarity and intensity labels per user over time and within entire conversational threads, thus making subtle opinion fluctuations detectable both in long term and in short term. all posts are annotated by non-experts and a significant portion of the data is also annotated by experts. we provide a strategy for recruiting suitable non-experts. our analysis of the inter-annotator agreements shows that the resulting annotations obtained from the majority vote of the non-experts are of comparable quality to the annotations of the experts. we provide analyses of the stance evolution in short term and long term levels, a comparison of language usage between users with vacillating and resolute attitudes, and fine-grained stance detection baselines.",['lrec-2022'],2022.lrec-1.405.pdf
58,753,vaccinelies: a natural language resource for learning to recognize misinformation about the covid-19 and hpv vaccines,2022,"billions of covid-19 vaccines have been administered, but many remain hesitant. misinformation about the covid-19 vaccines and other vaccines, propagating on social media, is believed to drive hesitancy towards vaccination. the ability to automatically recognize misinformation targeting vaccines on twitter depends on the availability of data resources. in this paper we present vaccinelies, a large collection of tweets propagating misinformation about two vaccines: the covid-19 vaccines and the human papillomavirus (hpv) vaccines. misinformation targets are organized in vaccine-specific taxonomies, which reveal the misinformation themes and concerns. the ontological commitments of the misinformation taxonomies provide an understanding of which misinformation themes and concerns dominate the discourse about the two vaccines covered in vaccinelies. the organization into training, testing and development sets of vaccinelies invites the development of novel supervised methods for detecting misinformation on twitter and identifying the stance towards it. furthermore, vaccinelies can be a stepping stone for the development of datasets focusing on misinformation targeting additional vaccines.",['lrec-2022'],2022.lrec-1.753.pdf
59,783,using convolution neural network with bert for stance detection in vietnamese,2022,"stance detection is the task of automatically eliciting stance information towards a specific claim made by a primary author. while most studies have been done for high-resource languages, this work is dedicated to a low-resource language, namely vietnamese. in this paper, we propose an architecture using transformers to detect stances in vietnamese claims. this architecture exploits bert to extract contextual word embeddings instead of using traditional word2vec models. then, these embeddings are fed into cnn networks to extract local features to train the stance detection model. we performed extensive comparison experiments to show the effectiveness of the proposed method on a public dataset1 experimental results show that this proposed model outperforms the previous methods by a large margin. it yielded an accuracy score of 75.57% averaged on four labels. this sets a new sota result for future research on this interesting problem in vietnamese.",['lrec-2022'],2022.lrec-1.783.pdf
60,801,polibertweet: a pre-trained language model for analyzing political content on twitter,2022,"transformer-based models have become the state-of-the-art for numerous natural language processing (nlp) tasks, especially for noisy data sets, including social media posts. for example, bertweet, pre-trained roberta on a large amount of twitter data, has achieved state-of-the-art results on several twitter nlp tasks. we argue that it is not only important to have general pre-trained models for a social media platform, but also domain-specific ones that better capture domain-specific language context. domain-specific resources are not only important for nlp tasks associated with a specific domain, but they are also useful for understanding language differences across domains. one domain that receives a large amount of attention is politics, more specifically political elections. towards that end, we release polibertweet, a pre-trained language model trained from bertweet on over 83m us 2020 election-related english tweets. while the construction of the resource is fairly straightforward, we believe that it can be used for many important downstream tasks involving language, including political misinformation analysis and election public opinion analysis. to show the value of this resource, we evaluate polibertweet on different nlp tasks. the results show that our model outperforms general-purpose language models in domain-specific contexts, highlighting the value of domain-specific models for more detailed linguistic analysis. we also extend other existing language models with a sample of these data and show their value for presidential candidate stance detection, a context-specific task. we release polibertweet and these other models to the community to advance interdisciplinary research related to election 2020.",['lrec-2022'],2022.lrec-1.801.pdf
61,17,political ideology and polarization: a multi-dimensional approach,2022,"analyzing ideology and polarization is of critical importance in advancing our grasp of modern politics. recent research has made great strides towards understanding the ideological bias (i.e., stance) of news media along the left-right spectrum. in this work, we instead take a novel and more nuanced approach for the study of ideology based on its left or right positions on the issue being discussed. aligned with the theoretical accounts in political science, we treat ideology as a multi-dimensional construct, and introduce the first diachronic dataset of news articles whose ideological positions are annotated by trained political scientists and linguists at the paragraph level. we showcase that, by controlling for the author’s stance, our method allows for the quantitative and temporal measurement and analysis of polarization as a multidimensional ideological distance. we further present baseline models for ideology prediction, outlining a challenging task distinct from stance detection.",['naacl-2022'],2022.naacl-main.17.pdf
