,id,title,year,abstract,venues,url
83,972,stance detection on social media with background knowledge,2023,"identifying users’ stances regarding specific targets/topics is a significant route to learning public opinion from social media platforms. most existing studies of stance detection strive to learn stance information about specific targets from the context, in order to determine the user’s stance on the target. however, in real-world scenarios, we usually have a certain understanding of a target when we express our stance on it. in this paper, we investigate stance detection from a novel perspective, where the background knowledge of the targets is taken into account for better stance detection. to be specific, we categorize background knowledge into two categories: episodic knowledge and discourse knowledge, and propose a novel knowledge-augmented stance detection (kasd) framework. for episodic knowledge, we devise a heuristic retrieval algorithm based on the topic to retrieve the wikipedia documents relevant to the sample. further, we construct a prompt for chatgpt to filter the wikipedia documents to derive episodic knowledge. for discourse knowledge, we construct a prompt for chatgpt to paraphrase the hashtags, references, etc., in the sample, thereby injecting discourse knowledge into the sample. experimental results on four benchmark datasets demonstrate that our kasd achieves state-of-the-art performance in in-target and zero-shot stance detection.",['emnlp-2023'],2023.emnlp-main.972.pdf
84,104,topic ontologies for arguments,2023,"many computational argumentation tasks, such as stance classification, are topic-dependent: the effectiveness of approaches to these tasks depends largely on whether they are trained with arguments on the same topics as those on which they are tested. the key question is: what are these training topics? to answer this question, we take the first step of mapping the argumentation landscape with the argument ontology (tao). tao draws on three authoritative sources for argument topics: the world economic forum, wikipedia’s list of controversial topics, and debatepedia. by comparing the topics in our ontology with those in 59 argument corpora, we perform the first comprehensive assessment of their topic coverage. while tao already covers most of the corpus topics, the corpus topics barely cover all the topics in tao. this points to a new goal for corpus construction to achieve a broad topic coverage and thus better generalizability of computational argumentation approaches.","['findings-2023', 'eacl-2023']",2023.findings-eacl.104.pdf
85,59,aqe: argument quadruplet extraction via a quad-tagging augmented generative approach,2023,"argument mining involves multiple sub-tasks that automatically identify argumentative elements, such as claim detection, evidence extraction, stance classification, etc. however, each subtask alone is insufficient for a thorough understanding of the argumentative structure and reasoning process. to learn a complete view of an argument essay and capture the interdependence among argumentative components, we need to know what opinions people hold (i.e., claims), why those opinions are valid (i.e., supporting evidence), which source the evidence comes from (i.e., evidence type), and how those claims react to the debating topic (i.e., stance). in this work, we for the first time propose a challenging argument quadruplet extraction task (aqe), which can provide an all-in-one extraction of four argumentative components, i.e., claims, evidence, evidence types, and stances. to support this task, we construct a large-scale and challenging dataset. however, there is no existing method that can solve the argument quadruplet extraction. to fill this gap, we propose a novel quad-tagging augmented generative approach, which leverages a quadruplet tagging module to augment the training of the generative framework. the experimental results on our dataset demonstrate the empirical superiority of our proposed approach over several strong baselines.","['findings-2023', 'acl-2023']",2023.findings-acl.59.pdf
86,115,disentangling aspect and stance via a siamese autoencoder for aspect clustering of vaccination opinions,2023,"mining public opinions about vaccines from social media has been increasingly relevant to analyse trends in public debates and to provide quick insights to policy-makers. however, the application of existing models has been hindered by the wide variety of users’ attitudes and the new aspects continuously arising in the public debate. existing approaches, frequently framed via well-known tasks, such as aspect classification or text span detection, make direct usage of the supervision information constraining the models to predefined aspect classes, while still not distinguishing those aspects from users’ stances. as a result, this has significantly hindered the dynamic integration of new aspects. we thus propose a model, namely disentangled opinion clustering (doc), for vaccination opinion mining from social media. doc is able to disentangle users’ stances from opinions via a disentangling attention mechanism and a swapping-autoencoder, and is designed to process unseen aspect categories via a clustering approach, leveraging clustering-friendly representations induced by out-of-the-box sentence-bert encodings and disentangling mechanisms. we conduct a thorough experimental assessment demonstrating the benefit of the disentangling mechanisms and cluster-based approach on both the quality of aspect clusters and the generalization across new aspect categories, outperforming existing methodologies on aspect-based opinion mining.","['findings-2023', 'acl-2023']",2023.findings-acl.115.pdf
87,393,distilling calibrated knowledge for stance detection,2023,"stance detection aims to determine the position of an author toward a target and provides insights into people’s views on controversial topics such as marijuana legalization. despite recent progress in this task, most existing approaches use hard labels (one-hot vectors) during training, which ignores meaningful signals among categories offered by soft labels. in this work, we explore knowledge distillation for stance detection and present a comprehensive analysis. our contributions are: 1) we propose to use knowledge distillation over multiple generations in which a student is taken as a new teacher to transfer knowledge to a new fresh student; 2) we propose a novel dynamic temperature scaling for knowledge distillation to calibrate teacher predictions in each generation step. extensive results on three stance detection datasets show that knowledge distillation benefits stance detection and a teacher is able to transfer knowledge to a student more smoothly via calibrated guiding signals. we publicly release our code to facilitate future research.","['findings-2023', 'acl-2023']",2023.findings-acl.393.pdf
88,399,target-oriented relation alignment for cross-lingual stance detection,2023,"stance detection is an important task in text mining and social media analytics, aiming to automatically identify the user’s attitude toward a specific target from text, and has wide applications in a variety of domains. previous work on stance detection has mainly focused on monolingual setting. to address the problem of imbalanced language resources, cross-lingual stance detection is proposed to transfer the knowledge learned from a high-resource (source) language (typically english) to another low-resource (target) language. however, existing research on cross-lingual stance detection has ignored the inconsistency in the occurrences and distributions of targets between languages, which consequently degrades the performance of stance detection in low-resource languages. in this paper, we first identify the target inconsistency issue in cross-lingual stance detection, and propose a fine-grained target-oriented relation alignment (tara) method for the task, which considers both target-level associations and language-level alignments. specifically, we propose the target relation graph to learn the in-language and cross-language target associations. we further devise the relation alignment strategy to enable knowledge transfer between semantically correlated targets across languages. experimental results on the representative datasets demonstrate the effectiveness of our method compared to competitive methods under variant settings.","['findings-2023', 'acl-2023']",2023.findings-acl.399.pdf
89,174,multi-label and multi-target sampling of machine annotation for computational stance detection,2023,"data collection from manual labeling provides domain-specific and task-aligned supervision for data-driven approaches, and a critical mass of well-annotated resources is required to achieve reasonable performance in natural language processing tasks. however, manual annotations are often challenging to scale up in terms of time and budget, especially when domain knowledge, capturing subtle semantic features, and reasoning steps are needed. in this paper, we investigate the efficacy of leveraging large language models on automated labeling for computational stance detection. we empirically observe that while large language models show strong potential as an alternative to human annotators, their sensitivity to task-specific instructions and their intrinsic biases pose intriguing yet unique challenges in machine annotation. we introduce a multi-label and multi-target sampling strategy to optimize the annotation quality. experimental results on the benchmark stance detection corpora show that our method can significantly improve performance and learning efficacy.","['findings-2023', 'emnlp-2023']",2023.findings-emnlp.174.pdf
90,273,chain-of-thought embeddings for stance detection on social media,2023,"stance detection on social media is challenging for large language models (llms), as emerging slang and colloquial language in online conversations often contain deeply implicit stance labels. chain-of-thought (cot) prompting has recently been shown to improve performance on stance detection tasks — alleviating some of these issues. however, cot prompting still struggles with implicit stance identification. this challenge arises because many samples are initially challenging to comprehend before a model becomes familiar with the slang and evolving knowledge related to different topics, all of which need to be acquired through the training data. in this study, we address this problem by introducing cot embeddings which improve cot performance on stance detection tasks by embedding cot reasonings and integrating them into a traditional roberta-based stance detection pipeline. our analysis demonstrates that 1) text encoders can leverage cot reasonings with minor errors or hallucinations that would otherwise distort the cot output label. 2) text encoders can overlook misleading cot reasoning when a sample’s prediction heavily depends on domain-specific patterns. our model achieves sota performance on multiple stance detection datasets collected from social media.","['findings-2023', 'emnlp-2023']",2023.findings-emnlp.273.pdf
91,295,"toxicity, morality, and speech act guided stance detection",2023,"in this work, we focus on the task of determining the public attitude toward various social issues discussed on social media platforms. platforms such as twitter, however, are often used to spread misinformation, fake news through polarizing views. existing literature suggests that higher levels of toxicity prevalent in twitter conversations often spread negativity and delay addressing issues. further, the embedded moral values and speech acts specifying the intention of the tweet correlate with public opinions expressed on various topics. however, previous works, which mainly focus on stance detection, either ignore the speech act, toxic, and moral features of these tweets that can collectively help capture public opinion or lack an efficient architecture that can detect the attitudes across targets. therefore, in our work, we focus on the main task of stance detection by exploiting the toxicity, morality, and speech act as auxiliary tasks. we propose a multitasking model twisted that initially extracts the valence, arousal, and dominance aspects hidden in the tweets and injects the emotional sense into the embedded text followed by an efficient attention framework to correctly detect the tweet’s stance by using the shared features of toxicity, morality, and speech acts present in the tweet. extensive experiments conducted on 4 benchmark stance detection datasets (semeval-2016, p-stance, covid19-stance, and climatechange) comprising different domains demonstrate the effectiveness and generalizability of our approach.","['findings-2023', 'emnlp-2023']",2023.findings-emnlp.295.pdf
92,387,investigating online community engagement through stancetaking,2023,"much work has explored lexical and semantic variation in online communities, and drawn connections to community identity and user engagement patterns. communities also express identity through the sociolinguistic concept of stancetaking. large-scale computational work on stancetaking has explored community similarities in their preferences for stance markers – words that serve to indicate aspects of a speaker’s stance – without considering the stance-relevant properties of the contexts in which stance markers are used. we propose representations of stance contexts for 1798 reddit communities and show how they capture community identity patterns distinct from textual or marker similarity measures. we also relate our stance context representations to broader inter- and intra-community engagement patterns, including cross-community posting patterns and social network properties of communities. our findings highlight the strengths of using rich properties of stance as a way of revealing community identity and engagement patterns in online multi-community spaces.","['findings-2023', 'emnlp-2023']",2023.findings-emnlp.387.pdf
93,432,dynamic stance: modeling discussions by labeling the interactions,2023,"stance detection is an increasingly popular task that has been mainly modeled as a static task, by assigning the expressed attitude of a text toward a given topic. such a framing presents limitations, with trained systems showing poor generalization capabilities and being strongly topic-dependent. in this work, we propose modeling stance as a dynamic task, by focusing on the interactions between a message and their replies. for this purpose, we present a new annotation scheme that enables the categorization of all kinds of textual interactions. as a result, we have created a new corpus, the dynamic stance corpus (dysc), consisting of three datasets in two middle-resourced languages: catalan and dutch. our data analysis further supports our modeling decisions, empirically showing differences between the annotation of stance in static and dynamic contexts. we fine-tuned a series of monolingual and multilingual models on dysc, showing portability across topics and languages.","['findings-2023', 'emnlp-2023']",2023.findings-emnlp.432.pdf
94,787,multilingual coarse political stance classification of media. the editorial line of a chatgpt and bard newspaper,2023,"neutrality is difficult to achieve and, in politics, subjective. traditional media typically adopt an editorial line that can be used by their potential readers as an indicator of the media bias. several platforms currently rate news outlets according to their political bias. the editorial line and the ratings help readers in gathering a balanced view of news. but in the advent of instruction-following language models, tasks such as writing a newspaper article can be delegated to computers. without imposing a biased persona, where would an ai-based news outlet lie within the bias ratings? in this work, we use the ratings of authentic news outlets to create a multilingual corpus of news with coarse stance annotations (left and right) along with automatically extracted topic annotations. we show that classifiers trained on this data are able to identify the editorial line of most unseen newspapers in english, german, spanish and catalan. we then apply the classifiers to 101 newspaper-like articles written by chatgpt and bard in the 4 languages at different time periods. we observe that, similarly to traditional newspapers, chatgpt editorial line evolves with time and, being a data-driven system, the stance of the generated articles differs among languages.","['findings-2023', 'emnlp-2023']",2023.findings-emnlp.787.pdf
95,901,beyond testers’ biases: guiding model testing with knowledge bases using llms,2023,"current model testing work has mostly focused on creating test cases. identifying what to test is a step that is largely ignored and poorly supported. we propose weaver, an interactive tool that supports requirements elicitation for guiding model testing. weaver uses large language models to generate knowledge bases and recommends concepts from them interactively, allowing testers to elicit requirements for further testing. weaver provides rich external knowledge to testers and encourages testers to systematically explore diverse concepts beyond their own biases. in a user study, we show that both nlp experts and non-experts identified more, as well as more diverse concepts worth testing when using weaver. collectively, they found more than 200 failing test cases for stance detection with zero-shot chatgpt. our case studies further show that weaver can help practitioners test models in real-world settings, where developers define more nuanced application scenarios (e.g., code understanding and transcript summarization) using llms.","['findings-2023', 'emnlp-2023']",2023.findings-emnlp.901.pdf
96,24,framing in the presence of supporting data: a case study in u.s. economic news,2024,"the mainstream media has much leeway in what it chooses to cover and how it covers it. these choices have real-world consequences on what people know and their subsequent behaviors. however, the lack of objective measures to evaluate editorial choices makes research in this area particularly difficult. in this paper, we argue that there are newsworthy topics where objective measures exist in the form of supporting data and propose a computational framework to analyze editorial choices in this setup. we focus on the economy because the reporting of economic indicators presents us with a relatively easy way to determine both the selection and framing of various publications. their values provide a ground truth of how the economy is doing relative to how the publications choose to cover it. to do this, we define frame prediction as a set of interdependent tasks. at the article level, we learn to identify the reported stance towards the general state of the economy. then, for every numerical quantity reported in the article, we learn to identify whether it corresponds to an economic indicator and whether it is being reported in a positive or negative way. to perform our analysis, we track six american publishers and each article that appeared in the top 10 slots of their landing page between 2015 and 2023.",['acl-2024'],2024.acl-long.24.pdf
97,49,tree-of-counterfactual prompting for zero-shot stance detection,2024,"stance detection enables the inference of attitudes from human communications. automatic stance identification was mostly cast as a classification problem. however, stance decisions involve complex judgments, which can be nowadays generated by prompting large language models (llms). in this paper we present a new method for stance identification which (1) relies on a new prompting framework, called tree-of-counterfactual prompting; (2) operates not only on textual communications, but also on images; (3) allows more than one stance object type; and (4) requires no examples of stance attribution, thus it is a “tabula rasa” zero-shot stance detection (tr-zssd) method. our experiments indicate surprisingly promising results, outperforming fine-tuned stance detection systems.",['acl-2024'],2024.acl-long.49.pdf
98,80,transitive consistency constrained learning for entity-to-entity stance detection,2024,"entity-to-entity stance detection identifies the stance between a pair of entities with a directed link that indicates the source, target and polarity. it is a streamlined task without the complex dependency structure for structural sentiment analysis, while it is more informative compared to most previous work assuming that the source is the author. previous work performs entity-to-entity stance detection training on individual entity pairs. however, stances between inter-connected entity pairs may be correlated. in this paper, we propose transitive consistency constrained learning, which first finds connected entity pairs and their stances, and adds an additional objective to enforce the transitive consistency. we explore consistency training on both classification-based and generation-based models and conduct experiments to compare consistency training with previous work and large language models with in-context learning. experimental results illustrate that the inter-correlation of stances in political news can be used to improve the entity-to-entity stance detection model, while overly strict consistency enforcement may have a negative impact. in addition, we find that large language models struggle with predicting link direction and neutral labels in this task.",['acl-2024'],2024.acl-long.80.pdf
99,509,whose preferences? differences in fairness preferences and their impact on the fairness of ai utilizing human feedback,2024,"there is a growing body of work on learning from human feedback to align various aspects of machine learning systems with human values and preferences. we consider the setting of fairness in content moderation, in which human feedback is used to determine how two comments — referencing different sensitive attribute groups — should be treated in comparison to one another. with a novel dataset collected from prolific and mturk, we find significant gaps in fairness preferences depending on the race, age, political stance, educational level, and lgbtq+ identity of annotators. we also demonstrate that demographics mentioned in text have a strong influence on how users perceive individual fairness in moderation. further, we find that differences also exist in downstream classifiers trained to predict human preferences. finally, we observe that an ensemble, giving equal weight to classifiers trained on annotations from different demographics, performs better for different demographic intersections; compared to a single classifier that gives equal weight to each annotation.",['acl-2024'],2024.acl-long.509.pdf
100,650,gunstance: stance detection for gun control and gun regulation,2024,"the debate surrounding gun control and gun regulation in the united states has intensified in the wake of numerous mass shooting events. as perspectives on this matter vary, it becomes increasingly important to comprehend individuals’ positions. stance detection, the task of determining an author’s position towards a proposition or target, has gained attention for its potential use in understanding public perceptions towards controversial topics and identifying the best strategies to address public concerns. in this paper, we present gunstance, a dataset of tweets pertaining to shooting events, focusing specifically on the controversial topics of “banning guns” versus “regulating guns.” the tweets in the dataset are sourced from discussions on twitter following various shooting incidents in the united states. amazon mechanical turk was used to manually annotate a subset of the tweets relevant to the targets of interest (“banning guns” and “regulating guns”) into three classes: in-favor, against, and neutral. the remaining unlabeled tweets are included in the dataset to facilitate studies on semi-supervised learning (ssl) approaches that can help address the scarcity of the labeled data in stance detection tasks. furthermore, we propose a hybrid approach that combines curriculum-based ssl and large language models (llm), and show that the proposed approach outperforms supervised, semi-supervised, and llm-based zero-shot models in most experiments on our assembled dataset.",['acl-2024'],2024.acl-long.650.pdf
