,id,title,year,abstract,venues,url
0,126,syntopical graphs for computational argumentation tasks,2021,"approaches to computational argumentation tasks such as stance detection and aspect detection have largely focused on the text of independent claims, losing out on potentially valuable context provided by the rest of the collection. we introduce a general approach to these tasks motivated by syntopical reading, a reading process that emphasizes comparing and contrasting viewpoints in order to improve topic understanding. to capture collection-level context, we introduce the syntopical graph, a data structure for linking claims within a collection. a syntopical graph is a typed multi-graph where nodes represent claims and edges represent different possible pairwise relationships, such as entailment, paraphrase, or support. experiments applying syntopical graphs to the problems of detecting stance and aspects demonstrate state-of-the-art performance in each domain, significantly outperforming approaches that do not utilize collection-level information.","['ijcnlp-2021', 'acl-2021']",2021.acl-long.126.pdf
1,127,stance detection in covid-19 tweets,2021,"the prevalence of the covid-19 pandemic in day-to-day life has yielded large amounts of stance detection data on social media sites, as users turn to social media to share their views regarding various issues related to the pandemic, e.g. stay at home mandates and wearing face masks when out in public. we set out to make use of this data by collecting the stance expressed by twitter users, with respect to topics revolving around the pandemic. we annotate a new stance detection dataset, called covid-19-stance. using this newly annotated dataset, we train several established stance detection models to ascertain a baseline performance for this specific task. to further improve the performance, we employ self-training and domain adaptation approaches to take advantage of large amounts of unlabeled data and existing stance detection datasets. the dataset, code, and other resources are available on github.","['ijcnlp-2021', 'acl-2021']",2021.acl-long.127.pdf
2,128,topic-aware evidence reasoning and stance-aware aggregation for fact verification,2021,"fact verification is a challenging task that requires simultaneously reasoning and aggregating over multiple retrieved pieces of evidence to evaluate the truthfulness of a claim. existing approaches typically (i) explore the semantic interaction between the claim and evidence at different granularity levels but fail to capture their topical consistency during the reasoning process, which we believe is crucial for verification; (ii) aggregate multiple pieces of evidence equally without considering their implicit stances to the claim, thereby introducing spurious information. to alleviate the above issues, we propose a novel topic-aware evidence reasoning and stance-aware aggregation model for more accurate fact verification, with the following four key properties: 1) checking topical consistency between the claim and evidence; 2) maintaining topical coherence among multiple pieces of evidence; 3) ensuring semantic similarity between the global topic information and the semantic representation of evidence; 4) aggregating evidence based on their implicit stances to the claim. extensive experiments conducted on the two benchmark datasets demonstrate the superiority of the proposed model over several state-of-the-art approaches for fact verification. the source code can be obtained from https://github.com/jasenchn/tarsa.","['ijcnlp-2021', 'acl-2021']",2021.acl-long.128.pdf
3,1,advances in debating technologies: building ai that can debate humans,2021,"the tutorial focuses on debating technologies, a sub-field of computational argumentation defined as “computational technologies developed directly to enhance, support, and engage with human debating” (gurevych et al., 2016). a recent milestone in this field is project debater, which was revealed in 2019 as the first ai system that can debate human experts on complex topics. project debater is the third in the series of ibm research ai’s grand challenges, following deep blue and watson. it has been developed for over six years by a large team of researchers and engineers, and its live demonstration in february 2019 received massive media attention. this research effort has resulted in more than 50 scientific papers to date, and many datasets freely available for research purposes. we discuss the scientific challenges that arise when building such a system, including argument mining, argument quality assessment, stance classification, principled argument detection, narrative generation, and rebutting a human opponent. many of the underlying capabilities of project debater have been made freely available for academic research, and the tutorial will include a detailed explanation of how to use and leverage these tools. in addition to discussing individual components, the tutorial also provides a holistic view of a debating system. such a view is largely missing in the academic literature, where each paper typically addresses a specific problem in isolation. we present a complete pipeline of a debating system, and discuss the information flow and the interaction between the various components. finally, we discuss practical applications and future challenges of debating technologies.","['ijcnlp-2021', 'acl-2021']",2021.acl-tutorials.1.pdf
4,147,learning from revisions: quality assessment of claims in argumentation at scale,2021,"assessing the quality of arguments and of the claims the arguments are composed of has become a key task in computational argumentation. however, even if different claims share the same stance on the same topic, their assessment depends on the prior perception and weighting of the different aspects of the topic being discussed. this renders it difficult to learn topic-independent quality indicators. in this paper, we study claim quality assessment irrespective of discussed aspects by comparing different revisions of the same claim. we compile a large-scale corpus with over 377k claim revision pairs of various types from kialo.com, covering diverse topics from politics, ethics, entertainment, and others. we then propose two tasks: (a) assessing which claim of a revision pair is better, and (b) ranking all versions of a claim by quality. our first experiments with embedding-based logistic regression and transformer-based neural networks show promising results, suggesting that learned indicators generalize well across topics. in a detailed error analysis, we give insights into what quality dimensions of claims can be assessed reliably. we provide the data and scripts needed to reproduce all results.",['eacl-2021'],2021.eacl-main.147.pdf
5,184,a unified feature representation for lexical connotations,2021,"ideological attitudes and stance are often expressed through subtle meanings of words and phrases. understanding these connotations is critical to recognizing the cultural and emotional perspectives of the speaker. in this paper, we use distant labeling to create a new lexical resource representing connotation aspects for nouns and adjectives. our analysis shows that it aligns well with human judgments. additionally, we present a method for creating lexical representations that capture connotations within the embedding space and show that using the embeddings provides a statistically significant improvement on the task of stance detection when data is limited.",['eacl-2021'],2021.eacl-main.184.pdf
6,227,a few topical tweets are enough for effective user stance detection,2021,"user stance detection entails ascertaining the position of a user towards a target, such as an entity, topic, or claim. recent work that employs unsupervised classification has shown that performing stance detection on vocal twitter users, who have many tweets on a target, can be highly accurate (+98%). however, such methods perform poorly or fail completely for less vocal users, who may have authored only a few tweets about a target. in this paper, we tackle stance detection for such users using two approaches. in the first approach, we improve user-level stance detection by representing tweets using contextualized embeddings, which capture latent meanings of words in context. we show that this approach outperforms two strong baselines and achieves 89.6% accuracy and 91.3% macro f-measure on eight controversial topics. in the second approach, we expand the tweets of a given user using their twitter timeline tweets, which may not be topically relevant, and then we perform unsupervised classification of the user, which entails clustering a user with other users in the training set. this approach achieves 95.6% accuracy and 93.1% macro f-measure.",['eacl-2021'],2021.eacl-main.227.pdf
7,12,a dashboard for mitigating the covid-19 misinfodemic,2021,"this paper describes the current milestones achieved in our ongoing project that aims to understand the surveillance of, impact of and intervention on covid-19 misinfodemic on twitter. specifically, it introduces a public dashboard which, in addition to displaying case counts in an interactive map and a navigational panel, also provides some unique features not found in other places. particularly, the dashboard uses a curated catalog of covid-19 related facts and debunks of misinformation, and it displays the most prevalent information from the catalog among twitter users in user-selected u.s. geographic regions. the paper explains how to use bert models to match tweets with the facts and misinformation and to detect their stance towards such information. the paper also discusses the results of preliminary experiments on analyzing the spatio-temporal spread of misinformation.",['eacl-2021'],2021.eacl-demos.12.pdf
8,27,(mis)alignment between stance expressed in social media data and public opinion surveys,2021,"stance detection, which aims to determine whether an individual is for or against a target concept, promises to uncover public opinion from large streams of social media data. yet even human annotation of social media content does not always capture “stance” as measured by public opinion polls. we demonstrate this by directly comparing an individual’s self-reported stance to the stance inferred from their social media data. leveraging a longitudinal public opinion survey with respondent twitter handles, we conducted this comparison for 1,129 individuals across four salient targets. we find that recall is high for both “pro’’ and “anti’’ stance classifications but precision is variable in a number of cases. we identify three factors leading to the disconnect between text and author stance: temporal inconsistencies, differences in constructs, and measurement errors from both survey respondents and annotators. by presenting a framework for assessing the limitations of stance detection models, this work provides important insight into what stance detection truly measures.",['emnlp-2021'],2021.emnlp-main.27.pdf
9,290,"abstract, rationale, stance: a joint model for scientific claim verification",2021,"scientific claim verification can help the researchers to easily find the target scientific papers with the sentence evidence from a large corpus for the given claim. some existing works propose pipeline models on the three tasks of abstract retrieval, rationale selection and stance prediction. such works have the problems of error propagation among the modules in the pipeline and lack of sharing valuable information among modules. we thus propose an approach, named as arsjoint, that jointly learns the modules for the three tasks with a machine reading comprehension framework by including claim information. in addition, we enhance the information exchanges and constraints among tasks by proposing a regularization term between the sentence attention scores of abstract retrieval and the estimated outputs of rational selection. the experimental results on the benchmark dataset scifact show that our approach outperforms the existing works.",['emnlp-2021'],2021.emnlp-main.290.pdf
10,397,just say no: analyzing the stance of neural dialogue generation in offensive contexts,2021,"dialogue models trained on human conversations inadvertently learn to generate toxic responses. in addition to producing explicitly offensive utterances, these models can also implicitly insult a group or individual by aligning themselves with an offensive statement. to better understand the dynamics of contextually offensive language, we investigate the stance of dialogue model responses in offensive reddit conversations. specifically, we create toxichat, a crowd-annotated dataset of 2,000 reddit threads and model responses labeled with offensive language and stance. our analysis reveals that 42% of human responses agree with toxic comments, whereas only 13% agree with safe comments. this undesirable behavior is learned by neural dialogue models, such as dialogpt, which we show are two times more likely to agree with offensive comments. to enable automatic detection of offensive language, we fine-tuned transformer-based classifiers on toxichat that achieve 0.71 f1 for offensive labels and 0.53 macro-f1 for stance labels. finally, we quantify the effectiveness of controllable text generation (ctg) methods to mitigate the tendency of neural dialogue models to agree with offensive comments. compared to the baseline, our best ctg model achieves a 19% reduction in agreement with offensive comments and produces 29% fewer offensive replies. our work highlights the need for further efforts to characterize and analyze inappropriate behavior in dialogue models, in order to help make them safer.",['emnlp-2021'],2021.emnlp-main.397.pdf
11,450,human rationales as attribution priors for explainable stance detection,2021,"as nlp systems become better at detecting opinions and beliefs from text, it is important to ensure not only that models are accurate but also that they arrive at their predictions in ways that align with human reasoning. in this work, we present a method for imparting human-like rationalization to a stance detection model using crowdsourced annotations on a small fraction of the training data. we show that in a data-scarce setting, our approach can improve the reasoning of a state-of-the-art classifier—particularly for inputs containing challenging phenomena such as sarcasm—at no cost in predictive performance. furthermore, we demonstrate that attention weights surpass a leading attribution method in providing faithful explanations of our model’s predictions, thus serving as a computationally cheap and reliable source of attributions for our model.",['emnlp-2021'],2021.emnlp-main.450.pdf
12,511,improving stance detection with multi-dataset learning and knowledge distillation,2021,"stance detection determines whether the author of a text is in favor of, against or neutral to a specific target and provides valuable insights into important events such as legalization of abortion. despite significant progress on this task, one of the remaining challenges is the scarcity of annotations. besides, most previous works focused on a hard-label training in which meaningful similarities among categories are discarded during training. to address these challenges, first, we evaluate a multi-target and a multi-dataset training settings by training one model on each dataset and datasets of different domains, respectively. we show that models can learn more universal representations with respect to targets in these settings. second, we investigate the knowledge distillation in stance detection and observe that transferring knowledge from a teacher model to a student model can be beneficial in our proposed training settings. moreover, we propose an adaptive knowledge distillation (akd) method that applies instance-specific temperature scaling to the teacher and student predictions. results show that the multi-dataset model performs best on all datasets and it can be further improved by the proposed akd, outperforming the state-of-the-art by a large margin. we publicly release our code.",['emnlp-2021'],2021.emnlp-main.511.pdf
13,547,tribrid: stance classification with neural inconsistency detection,2021,"we study the problem of performing automatic stance classification on social media with neural architectures such as bert. although these architectures deliver impressive results, their level is not yet comparable to the one of humans and they might produce errors that have a significant impact on the downstream task (e.g., fact-checking). to improve the performance, we present a new neural architecture where the input also includes automatically generated negated perspectives over a given claim. the model is jointly learned to make simultaneously multiple predictions, which can be used either to improve the classification of the original perspective or to filter out doubtful predictions. in the first case, we propose a weakly supervised method for combining the predictions into a final one. in the second case, we show that using the confidence scores to remove doubtful predictions allows our method to achieve human-like performance over the retained information, which is still a sizable part of the original input.",['emnlp-2021'],2021.emnlp-main.547.pdf
14,609,explagraphs: an explanation graph generation task for structured commonsense reasoning,2021,"recent commonsense-reasoning tasks are typically discriminative in nature, where a model answers a multiple-choice question for a certain context. discriminative tasks are limiting because they fail to adequately evaluate the model’s ability to reason and explain predictions with underlying commonsense knowledge. they also allow such models to use reasoning shortcuts and not be “right for the right reasons”. in this work, we present explagraphs, a new generative and structured commonsense-reasoning task (and an associated dataset) of explanation graph generation for stance prediction. specifically, given a belief and an argument, a model has to predict if the argument supports or counters the belief and also generate a commonsense-augmented graph that serves as non-trivial, complete, and unambiguous explanation for the predicted stance. we collect explanation graphs through a novel create-verify-and-refine graph collection framework that improves the graph quality (up to 90%) via multiple rounds of verification and refinement. a significant 79% of our graphs contain external commonsense nodes with diverse structures and reasoning depths. next, we propose a multi-level evaluation framework, consisting of automatic metrics and human evaluation, that check for the structural and semantic correctness of the generated graphs and their degree of match with ground-truth graphs. finally, we present several structured, commonsense-augmented, and text generation models as strong starting points for this explanation graph generation task, and observe that there is a large gap with human performance, thereby encouraging future work for this new challenging task.",['emnlp-2021'],2021.emnlp-main.609.pdf
15,710,cross-domain label-adaptive stance detection,2021,"stance detection concerns the classification of a writer’s viewpoint towards a target. there are different task variants, e.g., stance of a tweet vs. a full article, or stance with respect to a claim vs. an (implicit) topic. moreover, task definitions vary, which includes the label inventory, the data collection, and the annotation protocol. all these aspects hinder cross-domain studies, as they require changes to standard domain adaptation approaches. in this paper, we perform an in-depth analysis of 16 stance detection datasets, and we explore the possibility for cross-domain learning from them. moreover, we propose an end-to-end unsupervised framework for out-of-domain prediction of unseen, user-defined labels. in particular, we combine domain adaptation techniques such as mixture of experts and domain-adversarial training with label embeddings, and we demonstrate sizable performance gains over strong baselines, both (i) in-domain, i.e., for seen targets, and (ii) out-of-domain, i.e., for unseen targets. finally, we perform an exhaustive analysis of the cross-domain results, and we highlight the important factors influencing the model performance.",['emnlp-2021'],2021.emnlp-main.710.pdf
16,795,on classifying whether two texts are on the same side of an argument,2021,"to ease the difficulty of argument stance classification, the task of same side stance classification (s3c) has been proposed. in contrast to actual stance classification, which requires a substantial amount of domain knowledge to identify whether an argument is in favor or against a certain issue, it is argued that, for s3c, only argument similarity within stances needs to be learned to successfully solve the task. we evaluate several transformer-based approaches on the dataset of the recent s3c shared task, followed by an in-depth evaluation and error analysis of our model and the task’s hypothesis. we show that, although we achieve state-of-the-art results, our model fails to generalize both within as well as across topics and domains when adjusting the sampling strategy of the training and test set to a more adversarial scenario. our evaluation shows that current state-of-the-art approaches cannot determine same side stance by considering only domain-independent linguistic similarity features, but appear to require domain knowledge and semantic inference, too.",['emnlp-2021'],2021.emnlp-main.795.pdf
17,204,a multi-task learning framework for multi-target stance detection,2021,none,"['ijcnlp-2021', 'acl-2021', 'findings-2021']",2021.findings-acl.204.pdf
18,208,p-stance: a large dataset for stance detection in political domain,2021,none,"['ijcnlp-2021', 'acl-2021', 'findings-2021']",2021.findings-acl.208.pdf
19,278,enhancing zero-shot and few-shot stance detection with commonsense knowledge graph,2021,none,"['ijcnlp-2021', 'acl-2021', 'findings-2021']",2021.findings-acl.278.pdf
20,253,melt: message-level transformer with masked document representations as pre-training for stance detection,2021,"much of natural language processing is focused on leveraging large capacity language models, typically trained over single messages with a task of predicting one or more tokens. however, modeling human language at higher-levels of context (i.e., sequences of messages) is under-explored. in stance detection and other social media tasks where the goal is to predict an attribute of a message, we have contextual data that is loosely semantically connected by authorship. here, we introduce message-level transformer (melt) – a hierarchical message-encoder pre-trained over twitter and applied to the task of stance prediction. we focus on stance prediction as a task benefiting from knowing the context of the message (i.e., the sequence of previous messages). the model is trained using a variant of masked-language modeling; where instead of predicting tokens, it seeks to generate an entire masked (aggregated) message vector via reconstruction loss. we find that applying this pre-trained masked message-level transformer to the downstream task of stance detection achieves f1 performance of 67%.","['emnlp-2021', 'findings-2021']",2021.findings-emnlp.253.pdf
21,34,aspect-controlled neural argument generation,2021,"we rely on arguments in our daily lives to deliver our opinions and base them on evidence, making them more convincing in turn. however, finding and formulating arguments can be challenging. in this work, we present the arg-ctrl - a language model for argument generation that can be controlled to generate sentence-level arguments for a given topic, stance, and aspect. we define argument aspect detection as a necessary method to allow this fine-granular control and crowdsource a dataset with 5,032 arguments annotated with aspects. our evaluation shows that the arg-ctrl is able to generate high-quality, aspect-specific arguments, applicable to automatic counter-argument generation. we publish the model weights and all datasets and code to train the arg-ctrl.",['naacl-2021'],2021.naacl-main.34.pdf
22,148,target-aware data augmentation for stance detection,2021,"the goal of stance detection is to identify whether the author of a text is in favor of, neutral or against a specific target. despite substantial progress on this task, one of the remaining challenges is the scarcity of annotations. data augmentation is commonly used to address annotation scarcity by generating more training samples. however, the augmented sentences that are generated by existing methods are either less diversified or inconsistent with the given target and stance label. in this paper, we formulate the data augmentation of stance detection as a conditional masked language modeling task and augment the dataset by predicting the masked word conditioned on both its context and the auxiliary sentence that contains target and label information. moreover, we propose another simple yet effective method that generates target-aware sentence by replacing a target mention with the other. experimental results show that our proposed methods significantly outperforms previous augmentation methods on 11 targets.",['naacl-2021'],2021.naacl-main.148.pdf
