,id,title,year,abstract,venues,url
101,795,how to handle different types of out-of-distribution scenarios in computational argumentation? a comprehensive and fine-grained field study,2024,"the advent of pre-trained language models (lms) has markedly advanced natural language processing, but their efficacy in out-of-distribution (ood) scenarios remains a significant challenge. computational argumentation (ca), modeling human argumentation processes, is a field notably impacted by these challenges because complex annotation schemes and high annotation costs naturally lead to resources barely covering the multiplicity of available text sources and topics. due to this data scarcity, generalization to data from uncovered covariant distributions is a common challenge for ca tasks like stance detection or argument classification. this work systematically assesses lms’ capabilities for such ood scenarios. while previous work targets specific ood types like topic shifts or ood uniformly, we address three prevalent ood scenarios in ca: topic shift, domain shift, and language shift. our findings challenge the previously asserted general superiority of in-context learning (icl) for ood. we find that the efficacy of such learning paradigms varies with the type of ood. specifically, while icl excels for domain shifts, prompt-based fine-tuning surpasses for topic shifts. to sum up, we navigate the heterogeneity of ood scenarios in ca and empirically underscore the potential of base-sized lms in overcoming these challenges.",['acl-2024'],2024.acl-long.795.pdf
102,838,ez-stance: a large dataset for english zero-shot stance detection,2024,"zero-shot stance detection (zssd) aims to determine whether the author of a text is in favor, against, or neutral toward a target that is unseen during training. in this paper, we present ez-stance, a large english zssd dataset with 47,316 annotated text-target pairs. in contrast to vast, which is the only other large existing zssd dataset for english, ez-stance is 2.5 times larger, includes both noun-phrase targets and claim targets that cover a wide range of domains, provides two challenging subtasks for zssd: target-based zssd and domain-based zssd, and contains much harder examples for the neutral class. we evaluate ez-stance using state-of-the-art deep learning models. furthermore, we propose to transform zssd into the nli task by applying simple yet effective prompts to noun-phrase targets. our experimental results show that ez-stance is a challenging new benchmark, which provides significant research opportunities on english zssd. we publicly release our dataset and code at https://github.com/chenyez/ez-stance.",['acl-2024'],2024.acl-long.838.pdf
103,7,stance detection with explanations,2024,"identification of stance has recently gained a lot of attention with the extreme growth of fake news and filter bubbles. over the last decade, many feature-based and deep-learning approaches have been proposed to solve stance detection. however, almost none of the existing works focus on providing a meaningful explanation for their prediction. in this work, we study stance detection with an emphasis on generating explanations for the predicted stance by capturing the pivotal argumentative structure embedded in a document. we propose to build a stance tree that utilizes rhetorical parsing to construct an evidence tree and to use dempster shafer theory to aggregate the evidence. human studies show that our unsupervised technique of generating stance explanations outperforms the sota extractive summarization method in terms of informativeness, non-redundancy, coverage, and overall quality. furthermore, experiments show that our explanation-based stance prediction excels or matches the performance of the sota model on various benchmark datasets.",['cl-2024'],2024.cl-1.7.pdf
104,8,the role of typological feature prediction in nlp and linguistics,2024,"computational typology has gained traction in the field of natural language processing (nlp) in recent years, as evidenced by the increasing number of papers on the topic and the establishment of a special interest group on the topic (sigtyp), including the organization of successful workshops and shared tasks. a considerable amount of work in this sub-field is concerned with prediction of typological features, for example, for databases such as the world atlas of language structures (wals) or grambank. prediction is argued to be useful either because (1) it allows for obtaining feature values for relatively undocumented languages, alleviating the sparseness in wals, in turn argued to be useful for both nlp and linguistics; and (2) it allows us to probe models to see whether or not these typological features are encapsulated in, for example, language representations. in this article, we present a critical stance concerning prediction of typological features, investigating to what extent this line of research is aligned with purported needs—both from the perspective of nlp practitioners, and perhaps more importantly, from the perspective of linguists specialized in typology and language documentation. we provide evidence that this line of research in its current state suffers from a lack of interdisciplinary alignment. based on an extensive survey of the linguistic typology community, we present concrete recommendations for future research in order to improve this alignment between linguists and nlp researchers, beyond the scope of typological feature prediction.",['cl-2024'],2024.cl-2.8.pdf
105,92,style-news: incorporating stylized news generation and adversarial verification for neural fake news detection,2024,"with the improvements in generative models, the issues of producing hallucinations in various domains (e.g., law, writing) have been brought to people’s attention due to concerns about misinformation. in this paper, we focus on neural fake news, which refers to content generated by neural networks aiming to mimic the style of real news to deceive people. to prevent harmful disinformation spreading fallaciously from malicious social media (e.g., content farms), we propose a novel verification framework, style-news, using publisher metadata to imply a publisher’s template with the corresponding text types, political stance, and credibility. based on threat modeling aspects, a style-aware neural news generator is introduced as an adversary for generating news content conditioning for a specific publisher, and style and source discriminators are trained to defend against this attack by identifying which publisher the style corresponds with, and discriminating whether the source of the given news is human-written or machine-generated. to evaluate the quality of the generated content, we integrate various dimensional metrics (language fluency, content preservation, and style adherence) and demonstrate that style-news significantly outperforms the previous approaches by a margin of 0.35 for fluency, 15.24 for content, and 0.38 for style at most. moreover, our discriminative model outperforms state-of-the-art baselines in terms of publisher prediction (up to 4.64%) and neural fake news detection (+6.94% 31.72%). we plan to release our style-news publicly, with the aim of improving neural fake news detection.",['eacl-2024'],2024.eacl-long.92.pdf
106,107,unsupervised stance detection for social media discussions: a generic baseline,2024,"with the ever-growing use of social media to express opinions on the national and international stage, unsupervised methods of stance detection are increasingly important to handle the task without costly annotation of data. the current unsupervised state-of-the-art models are designed for specific network types, either homophilic or heterophilic, and they fail to generalize to both. in this paper, we first analyze the generalization ability of recent baselines to these two very different network types. then, we conduct extensive experiments with a baseline model based on text embeddings propagated with a graph neural network that generalizes well to heterophilic and homophilic networks. we show that it outperforms, on average, other state-of-the-art methods across the two network types. additionally, we show that combining textual and network information outperforms using text only, and that the language model size has only a limited impact on the model performance.",['eacl-2024'],2024.eacl-long.107.pdf
107,108,putting context in context: the impact of discussion structure on text classification,2024,"current text classification approaches usually focus on the content to be classified. contextual aspects (both linguistic and extra-linguistic) are usually neglected, even in tasks based on online discussions. still in many cases the multi-party and multi-turn nature of the context from which these elements are selected can be fruitfully exploited. in this work, we propose a series of experiments on a large dataset for stance detection in english, in which we evaluate the contribution of different types of contextual information, i.e. linguistic, structural and temporal, by feeding them as natural language input into a transformer-based model. we also experiment with different amounts of training data and analyse the topology of local discussion networks in a privacy-compliant way. results show that structural information can be highly beneficial to text classification but only under certain circumstances (e.g. depending on the amount of training data and on discussion chain complexity). indeed, we show that contextual information on smaller datasets from other classification tasks does not yield significant improvements. our framework, based on local discussion networks, allows the integration of structural information while minimising user profiling, thus preserving their privacy.",['eacl-2024'],2024.eacl-long.108.pdf
108,24,sig-networks toolkit: signature networks for longitudinal language modelling,2024,"we present an open-source, pip installable toolkit, sig-networks, the first of its kind for longitudinal language modelling. a central focus is the incorporation of signature-based neural network models, which have recently shown success in temporal tasks. we apply and extend published research providing a full suite of signature-based models. their components can be used as pytorch building blocks in future architectures. sig-networks enables task-agnostic dataset plug-in, seamless preprocessing for sequential data, parameter flexibility, automated tuning across a range of models. we examine signature networks under three different nlp tasks of varying temporal granularity: counselling conversations, rumour stance switch and mood changes in social media threads, showing sota performance in all three, and provide guidance for future tasks. we release the toolkit as a pytorch package with an introductory video, git repositories for preprocessing and modelling including sample notebooks on the modeled nlp tasks.",['eacl-2024'],2024.eacl-demo.24.pdf
109,128,“tell me who you are and i tell you how you argue”: predicting stances and arguments for stakeholder groups,2024,"argument mining has focused so far mainly on the identification, extraction, and formalization of arguments. an important yet unaddressedtask consists in the prediction of the argumentative behavior of stakeholders in a debate. predicting the argumentative behavior in advance can support foreseeing issues in public policy making or help recognize potential disagreements early on and help to resolve them. in this paper, we consider the novel task of predicting the argumentative behavior of individual stakeholders. we present argenst, a framework that relies on a recommender-based architecture to predict the stance and the argumentative main point on a specific controversial topic for a given stakeholder, which is described in terms of a profile including properties related to demographic attributes, religious and political orientation, socio-economic background, etc. we evaluate our approach on the well-known debate.org dataset in terms of accuracy for predicting stance as well as in terms of similarity of the generated arguments to the ground truth arguments using bertscore. as part of a case study, we show how juries of members representing different stakeholder groups and perspectives can be assembled to simulate the public opinion on a given topic.","['findings-2024', 'naacl-2024']",2024.findings-naacl.128.pdf
110,155,dell: generating reactions and explanations for llm-based misinformation detection,2024,"large language models are limited by challenges in factuality and hallucinations to be directly employed off-the-shelf for judging the veracity of news articles, where factual accuracy is paramount. in this work, we propose dell that identifies three key stages in misinformation detection where llms could be incorporated as part of the pipeline: 1) llms could generate news reactions to represent diverse perspectives and simulate user-news interaction networks; 2) llms could generate explanations for proxy tasks (e.g., sentiment, stance) to enrich the contexts of news articles and produce experts specializing in various aspects of news understanding; 3) llms could merge task-specific experts and provide an overall prediction by incorporating the predictions and confidence scores of varying experts. extensive experiments on seven datasets with three llms demonstrate that dell outperforms state-of-the-art baselines by up to 16.8% in macro f1-score. further analysis reveals that the generated reactions and explanations are greatly helpful in misinformation detection, while our proposed llm-guided expert merging helps produce better-calibrated predictions.","['findings-2024', 'acl-2024']",2024.findings-acl.155.pdf
111,192,"pro-woman, anti-man? identifying gender bias in stance detection",2024,"gender bias has been widely observed in nlp models, which has the potential to perpetuate harmful stereotypes and discrimination. in this paper, we construct a dataset genderstance of 36k samples to measure gender bias in stance detection, determining whether models consistently predict the same stance for a particular gender group. we find that all models are gender-biased and prone to classify sentences that contain male nouns as against and those with female nouns as favor. moreover, extensive experiments indicate that sources of gender bias stem from the fine-tuning data and the foundation model itself. we will publicly release our code and dataset.","['findings-2024', 'acl-2024']",2024.findings-acl.192.pdf
112,304,play guessing game with llm: indirect jailbreak attack with implicit clues,2024,"with the development of llms, the security threats of llms are getting more and more attention. numerous jailbreak attacks have been proposed to assess the security defense of llms. current jailbreak attacks primarily utilize scenario camouflage techniques. however their explicitly mention of malicious intent will be easily recognized and defended by llms. in this paper, we propose an indirect jailbreak attack approach, puzzler, which can bypass the llm’s defensive strategies and obtain malicious response by implicitly providing llms with some clues about the original malicious query. in addition, inspired by the wisdom of “when unable to attack, defend” from sun tzu’s art of war, we adopt a defensive stance to gather clues about the original malicious query through llms. the experimental results indicate that the query success rate of the puzzler is 14.0%-82.7% higher than baselines on the most prominent llms. furthermore, when tested against the state-of-the-art jailbreak detection approaches, puzzler proves to be more effective at evading detection compared to baselines.","['findings-2024', 'acl-2024']",2024.findings-acl.304.pdf
113,586,evaluating large language model biases in persona-steered generation,2024,"the task of persona-steered text generation requires large language models (llms) to generate text that reflects the distribution of views that an individual fitting a persona could have. people have multifaceted personas, but prior work on bias in llm-generated opinions has only explored multiple-choice settings or one-dimensional personas. we define an incongruous persona as a persona with multiple traits where one trait makes its other traits less likely in human survey data, e.g. political liberals who support increased military spending. we find that llms are 9.7% less steerable towards incongruous personas than congruous ones, sometimes generating the stereotypical stance associated with its demographic rather than the target stance. models that we evaluate that are fine-tuned with reinforcement learning from human feedback (rlhf) are more steerable, especially towards stances associated with political liberals and women, but present significantly less diverse views of personas. we also find variance in llm steerability that cannot be predicted from multiple-choice opinion evaluation. our results show the importance of evaluating models in open-ended text generation, as it can surface new llm opinion biases. moreover, such a setup can shed light on our ability to steer models toward a richer and more diverse range of viewpoints.","['findings-2024', 'acl-2024']",2024.findings-acl.586.pdf
114,736,multi-modal stance detection: new datasets and model,2024,"stance detection is a challenging task that aims to identify public opinion from social media platforms with respect to specific targets. previous work on stance detection largely focused on pure texts. in this paper, we study multi-modal stance detection for tweets consisting of texts and images, which are prevalent in today’s fast-growing social media platforms where people often post multi-modal messages. to this end, we create five new multi-modal stance detection datasets of different domains based on twitter, in which each example consists of a text and an image. in addition, we propose a simple yet effective targeted multi-modal prompt tuning framework (tmpt), where target information is leveraged to learn multi-modal stance features from textual and visual modalities. experimental results on our five benchmark datasets show that the proposed tmpt achieves state-of-the-art performance in multi-modal stance detection.","['findings-2024', 'acl-2024']",2024.findings-acl.736.pdf
115,794,zerostance: leveraging chatgpt for open-domain stance detection via dataset generation,2024,"zero-shot stance detection that aims to detect the stance (typically against, favor, or neutral) towards unseen targets has attracted considerable attention. however, most previous studies only focus on targets from a single or limited text domains (e.g., financial domain), and thus zero-shot models cannot generalize well to unseen targets of diverse domains (e.g., political domain). in this paper, we consider a more realistic task, i.e., open-domain stance detection, which aims at training a model that is able to generalize well to unseen targets across multiple domains of interest. particularly, we propose a novel dataset generation method zerostance, which leverages chatgpt to construct a synthetic open-domain dataset chatstance that covers a wide range of domains. we then train an open-domain model on our synthetic dataset after proper data filtering. extensive results indicate that our model, when trained on this synthetic dataset, shows superior generalization to unseen targets of diverse domains over baselines on most benchmarks. our method requires only a task description in the form of a prompt and is much more cost-effective and data-efficient than previous methods. we will release our code and data to facilitate future research.","['findings-2024', 'acl-2024']",2024.findings-acl.794.pdf
116,796,reinforcement tuning for detecting stances and debunking rumors jointly with large language models,2024,"learning multi-task models for jointly detecting stance and verifying rumors poses challenges due to the need for training data of stance at post level and rumor veracity at claim level, which are difficult to obtain. to address this issue, we leverage large language models (llms) as the foundation annotators for the joint stance detection (sd) and rumor verification (rv) tasks, dubbed as jsdrv. we introduce a novel reinforcement tuning framework to enhance the joint predictive capabilities of llm-based sd and rv components. specifically, we devise a policy for selecting llm-annotated data at the two levels, employing a hybrid reward mechanism to choose high-quality labels for effective llm fine-tuning on both tasks. results demonstrate that jsdrv improves the capabilities of llms in the joint tasks, not only outperforming state-of-the-art methods but also generalizing to non-llms accommodated as task models.","['findings-2024', 'acl-2024']",2024.findings-acl.796.pdf
117,956,can llms speak for diverse people? tuning llms via debate to generate controllable controversial statements,2024,"making llms speak for different, especially minority groups of people, and generate statements supporting their diverse or even controversial perspectives is critical to creating an inclusive environment. however, existing llms lack sufficient controllability to the stance of their generated content, which often contains inconsistent, neutral, or biased statements. in this paper, we improve the controllability of llms in generating statements supporting an argument the user defined in the prompt. we find that multi-round debates between two llms with opposite stances generate higher-quality and more salient statements for each, which are important training data to improve the controllability of llms. motivated by this, we develop a novel debate & tuning (“debatune”) pipeline finetuning llms to generate the statements obtained via debate. to examine debatune, we curate the largest dataset of debate topics so far, which covers 710 controversial topics and corresponding arguments for each topic. evaluations by the gpt-4 judge with a novel controversy controllability metric show that llms’ capability of generating diverse perspectives is significantly improved by debatune. moreover, such controllability can be generalized to unseen topics, generating high-quality statements supporting controversial arguments.","['findings-2024', 'acl-2024']",2024.findings-acl.956.pdf
118,11,a challenge dataset and effective models for conversational stance detection,2024,"previous stance detection studies typically concentrate on evaluating stances within individual instances, thereby exhibiting limitations in effectively modeling multi-party discussions concerning the same specific topic, as naturally transpire in authentic social media interactions. this constraint arises primarily due to the scarcity of datasets that authentically replicate real social media contexts, hindering the research progress of conversational stance detection. in this paper, we introduce a new multi-turn conversation stance detection dataset (called mt-csd), which encompasses multiple targets for conversational stance detection. to derive stances from this challenging dataset, we propose a global-local attention network (glan) to address both long and short-range dependencies inherent in conversational data. notably, even state-of-the-art stance detection methods, exemplified by glan, exhibit an accuracy of only 50.47%, highlighting the persistent challenges in conversational stance detection. furthermore, our mt-csd dataset serves as a valuable resource to catalyze advancements in cross-domain stance detection, where a classifier is adapted from a different yet related target. we believe that mt-csd will contribute to advancing real-world applications of stance detection research. our source code, data, and models are available at https://github.com/nfq729/mt-csd.","['lrec-2024', 'coling-2024']",2024.lrec-main.11.pdf
